{
  "schemaVersion": "1.0",
  "storyId": "M5-D-C2-001",
  "nodes": [
    {
      "taskId": "T1",
      "title": "扩展 Wave Ledger 状态与 C2 证据契约",
      "type": "integration",
      "status": "pending",
      "ownerAgent": "backend-developer",
      "predictedFiles": [
        ".harness/scripts/lib/worktree-wave-execution-runtime.mjs",
        ".harness/scripts/tests/worktree-wave-execution-runtime.test.mjs",
        ".harness/schemas/worktree-wave-execution-ledger.schema.json"
      ],
      "acceptanceCriteria": [
        "freeze、integration 和 finalized 状态由任务与证据确定性派生",
        "C1 ledger 状态与验证行为保持兼容"
      ]
    },
    {
      "taskId": "T2",
      "title": "实现 integration manifest 原子冻结与恢复",
      "type": "integration",
      "status": "pending",
      "ownerAgent": "backend-developer",
      "predictedFiles": [
        ".harness/scripts/lib/worktree-wave-execution-runtime.mjs",
        ".harness/scripts/tests/worktree-wave-execution-runtime.test.mjs",
        ".harness/schemas/worktree-wave-integration-manifest.schema.json",
        ".harness/schemas/worktree-wave-manifest-preparation-lock.schema.json"
      ],
      "acceptanceCriteria": [
        "只有全部任务 ready 且执行证据与 Git 事实一致时才能冻结",
        "并发 freeze 只有一个 owner，显式 recover-freeze 绑定当前锁与 ledger 哈希",
        "manifest 写入后 C1 所有变更入口关闭"
      ]
    },
    {
      "taskId": "T3",
      "title": "实现 integration owner 与主工作树串行集成",
      "type": "integration",
      "status": "pending",
      "ownerAgent": "backend-developer",
      "predictedFiles": [
        ".harness/scripts/lib/worktree-wave-execution-runtime.mjs",
        ".harness/scripts/tests/worktree-wave-execution-runtime.test.mjs",
        ".harness/schemas/worktree-wave-integration-lock.schema.json",
        ".harness/schemas/worktree-wave-integration-receipt.schema.json"
      ],
      "acceptanceCriteria": [
        "integration/recovery owner 在每个主树写点、回执、ledger 和锁释放前接受 fencing",
        "主树写入前拒绝冲突、范围外候选、HEAD 漂移和额外业务变化",
        "任务严格按 WavePlan 稳定顺序集成"
      ]
    },
    {
      "taskId": "T4",
      "title": "实现 partial integration 前缀恢复",
      "type": "integration",
      "status": "pending",
      "ownerAgent": "backend-developer",
      "predictedFiles": [
        ".harness/scripts/lib/worktree-wave-execution-runtime.mjs",
        ".harness/scripts/tests/worktree-wave-execution-runtime.test.mjs"
      ],
      "acceptanceCriteria": [
        "部分失败保留已集成文件与回执，不回滚主树",
        "恢复先重验已集成前缀，再从首个剩余任务继续",
        "前缀或外部业务文件漂移时失败关闭"
      ]
    },
    {
      "taskId": "T5",
      "title": "实现 finalize-wave 与 M3 apply 绑定",
      "type": "integration",
      "status": "pending",
      "ownerAgent": "backend-developer",
      "predictedFiles": [
        ".harness/scripts/lib/story-runtime.mjs",
        ".harness/scripts/lib/worktree-wave-execution-runtime.mjs",
        ".harness/scripts/run-story.ps1",
        ".harness/scripts/tests/story-runtime.test.mjs",
        ".harness/scripts/tests/worktree-wave-execution-runtime.test.mjs",
        ".harness/schemas/worktree-wave-receipt.schema.json"
      ],
      "acceptanceCriteria": [
        "finalize-wave 生成正式 phase 产物、wave receipt、finalized ledger 和 checkpoint.waveFinalization",
        "finalize 不推进 state，既有 M3 apply 是唯一推进入口",
        "apply 重验全部绑定并支持推进前后中断的幂等恢复"
      ]
    },
    {
      "taskId": "T6",
      "title": "完成结构登记、文档和最终回归",
      "type": "docs",
      "status": "pending",
      "ownerAgent": "task-planner",
      "predictedFiles": [
        ".harness/structure-manifest.yaml",
        ".harness/README.md",
        ".harness/scripts/README.md",
        "docs/harness-architecture-adaptation.md",
        "docs/harness-structure-checklist.md",
        "docs/AI-handover.md",
        "llm-knowledge/overview.md",
        "docs/harness-m5d-wave-execution/REPORT-C2.md"
      ],
      "acceptanceCriteria": [
        "C2 专项、C1/M3 直接回归、结构和 Smoke 门禁通过",
        "文档准确说明 C2 能力与延期边界",
        "最终 Review 无未解决 BLOCKER 或 WARNING"
      ]
    }
  ],
  "edges": [
    {
      "from": "T1",
      "to": "T2",
      "reason": "manifest freeze 必须建立在扩展后的确定性 ledger 契约上"
    },
    {
      "from": "T2",
      "to": "T3",
      "reason": "主树集成必须消费已冻结且不可变的 manifest"
    },
    {
      "from": "T3",
      "to": "T4",
      "reason": "partial recovery 必须基于逐任务 integration receipt 和 owner fencing"
    },
    {
      "from": "T4",
      "to": "T5",
      "reason": "finalize-wave 只接受全部任务完成串行集成后的 ledger"
    },
    {
      "from": "T5",
      "to": "T6",
      "reason": "结构登记和最终回归必须基于完整 C2 行为"
    }
  ],
  "waves": [
    ["T1"],
    ["T2"],
    ["T3"],
    ["T4"],
    ["T5"],
    ["T6"]
  ],
  "globalChanges": [],
  "risks": [
    "Wave ledger 与 story-runtime 是共享入口，必须保持 C1、ordinary 和 serial batch 回归",
    "多文件集成不是全局事务，恢复正确性依赖确定性前缀与逐任务回执",
    "普通 JSON 锁不是 OS 级租约，遗留恢复必须保持显式确认与哈希绑定"
  ]
}
